<?xml version="1.0" encoding="UTF-8"?>
<Person xmlns:xsi="http://www.w3.org/2001/XMLSchema-instance" xsi:noNamespaceSchemaLocation="demo.xsd">
	<Name>omer</Name>
	<Address>
		<Number>123</Number>
		<Street>haram</Street>
	</Address>
	<Address>
		<Number>456</Number>
		<Street>HARAM</Street>
	</Address>
</Person>
